{
  "schemaVersion": "1.0.0",
  "kind": "archive-export",
  "exportedAt": "2026-01-08T09:15:00+01:00",
  "account": {"displayName":"Maya (personnage fictif)","roles":["apprenant"],"preferences":{"theme":"clair","confidentialiteParDefaut":"prive"}},
  "portfolios": [
    {
      "id": "portfolio-maya-3j",
      "titre": "Journal de bord — stage de médiation culturelle (janvier 2026)",
      "source": "colle",
      "texte": "# Journal de bord — Maya, formation de médiatrice culturelle (fixture de test, personnage fictif)\n\n## Lundi 5 janvier 2026\n\nPremière semaine de la nouvelle année à l'Astrolabe. Matin gris, la salle sentait encore la peinture, et j'ai refait trois fois l'ordre du premier mur avant d'être contente. Le matin, j'ai fini d'accrocher le parcours « Mémoires du quartier ». Il a fallu trancher dans la sélection : j'ai écarté douze clichés trop anecdotiques et gardé la série des mains au travail : c'est elle qui tient le propos de l'expo. Camille n'était pas convaincue au début, puis elle a vu le mur monté et elle a dit d'accord.\n\nL'après-midi, la classe de CM2 de Mme Ferrand. Trente élèves dans la salle des portraits, c'est beaucoup. Naël s'est figé devant le groupe ; je me suis accroupie à sa hauteur et je lui ai proposé de tenir la lampe du parcours, son rôle à lui. Il a fini la visite au premier rang. Je ne sais pas d'où m'est venu ce réflexe, mais il a marché.\n\nJ'ai senti que la classe décrochait après la troisième salle, alors j'ai raccourci le passage sur les archives. Tant pis pour mon plan de visite, il était trop ambitieux de toute façon.\n\nUn moment dont je suis contente : plutôt que d'expliquer la photo de la halle, j'ai demandé : « qu'est-ce qui manque sur cette image ? » Ils ont trouvé seuls la réponse (les femmes). Le silence avant que ça fuse, c'est exactement ce que je cherche dans ce métier, je crois.\n\nJ'ai aussi laissé deux élèves guider le groupe entre la salle 2 et la salle 3, avec la carte du parcours. Ils se sont trompés de couloir, le groupe a ri, on est revenus. Rien de grave.\n\nFin de journée moins glorieuse : j'ai condensé la réunion de préparation en dix lignes pour les collègues, mais j'ai mélangé décisions et impressions. Camille me l'a fait remarquer gentiment. Elle a raison, ma note ne dit pas qui fait quoi.\n\nCe soir, en relisant ma journée, je remarque que j'écris toujours « on » quand j'ai peur d'assumer un choix. C'est mon deuxième carnet et le tic revient. Je le note pour le voir venir.\n\nJe garde une question pour demain : est-ce que je rassure les enfants pour eux, ou pour me rassurer moi ?\n\nCôté intendance : réserver la salle du fond pour l'atelier de mardi, racheter des gommettes pour le vote des photos préférées, et rappeler l'imprimeur pour les cartels manquants de la salle 3.\n\nDemain, l'atelier avec les ados du collège Ronsard. J'ai un peu peur de Sofiane, autant l'écrire.\n\n## Mardi 6 janvier 2026\n\nJournée dense. Atelier « Raconte ton quartier » avec les quatrièmes de Ronsard, onze ados, deux heures.\n\nAvant l'atelier, une vérification qui me tenait à cœur : la légende datait la halle de 1932 ; la fiche des archives municipales dit 1928. J'ai corrigé le cartel et noté la source. Petite victoire invisible, mais si un ancien du quartier avait vu l'erreur au vernissage, toute l'expo aurait perdu son crédit.\n\nL'atelier a failli m'échapper. Sofiane a lancé une vanne sur la photo de Lina, elle a répondu sec, le ton est monté. Lina est sortie au bord des larmes ; je l'ai rejointe dans le couloir, on a parlé cinq minutes, puis elle est revenue d'elle-même. Je n'ai pas puni Sofiane, je ne sais pas si c'était le bon choix. Sofiane provoque, mais j'ai remarqué qu'il provoque surtout quand on parle de son immeuble. Il y a quelque chose là-dessous que je ne comprends pas encore.\n\nL'atelier partait en vrille : j'ai cassé le grand cercle et reformé trois petits groupes, chacun autour d'une photo. D'un coup, tout le monde avait quelque chose à faire. Ce qui m'aurait mise en panique en septembre m'a presque amusée aujourd'hui.\n\nJ'ai terminé l'atelier par un tour de « météo intérieure », et cette fois tout le monde a joué le jeu. Même Sofiane, qui a dit « nuageux ». C'est peu et c'est énorme.\n\nSur les familles : le grand-père de Yusuf ne me serre pas la main ; je le salue désormais de la tête, main sur le cœur, comme il le fait. Et j'ai fait traduire la consigne de l'atelier en trois langues par les ados eux-mêmes. Ils étaient fiers, et les affiches sont plus belles que les miennes.\n\nPendant la pause, Fatou m'a montré les affiches de la fête de quartier de 1998 retrouvées dans la réserve. Ça donne envie de creuser les archives associatives — je le note dans la liste des pistes pour le printemps.\n\nMoins à mon honneur : devant le groupe, j'ai dit que tout allait bien alors que j'étais en colère contre moi-même. Et avec Karim, je n'arrive pas encore à dire les choses simplement : je tourne autour. J'aurais dû dire à Karim que le créneau du mardi ne convient pas aux familles ; je ne l'ai pas fait. Je me raconte que c'est du tact, mais c'est de l'évitement.\n\nDétail bête mais qui m'a pris vingt minutes : le règlement intérieur interdit l'affichage au scotch. Trouver des aimants avant demain.\n\nDemain c'est le grand soir : la restitution publique, avec les habitants et l'adjointe à la culture. J'ai le trac en écrivant ces lignes.\n\n## Mercredi 7 janvier 2026\n\nLe vernissage a eu lieu, et je crois que je peux écrire : c'était réussi. Pas parfait, réussi.\n\nÀ 17h, la pluie menaçait : j'ai tranché pour rapatrier la lecture en salle, quitte à perdre la déambulation. On ne saura jamais si c'était le bon choix, et je m'en accommode. Six mois plus tôt, j'aurais demandé à Karim de décider à ma place.\n\nQuarante personnes, dont l'adjointe à la culture : j'ai senti le trac se transformer en énergie dès la première salle. Puis le micro a lâché au début de la visite ; j'ai fait asseoir tout le monde plus près et j'ai continué à voix nue, en jouant des silences. Bizarrement, la panne a rapproché le groupe. J'ai improvisé le passage sur les commerces disparus quand j'ai vu les anciens hocher la tête.\n\nLes deux ados co-guides ont mené la salle des portraits ; je suis restée en retrait, je n'ai soufflé qu'une seule fois. Avant la visite, je leur ai fait répéter non pas le texte, mais les questions qu'ils poseraient au public. C'est Lina qui a eu la plus belle relance de la soirée.\n\nMme Berthier restait seule près du vestiaire ; je lui ai apporté une chaise et je l'ai présentée au groupe de la chorale. Elle est restée jusqu'à la fin. J'ai gardé un œil sur Lina toute la soirée ; elle a présenté sa photo sans trembler. Et l'enseignante de CM2 m'a écrit : « vous avez vu Naël avant même qu'il lève la main, merci. » Ce message, je le garde.\n\nUne alerte tout de même : une habitante affirme que la photo du lavoir date d'avant-guerre ; le cartel dit 1952. Je n'ai pas eu le temps de vérifier, je note pour demain. Je ne veux pas refaire le coup de la halle à l'envers.\n\nL'adjointe est restée trois quarts d'heure et a promis de « voir ce qu'on peut faire » pour la subvention du printemps. Formule que j'apprends à traduire — Camille dit que c'est déjà bien qu'elle soit restée après les discours.\n\nAprès le départ du public, comité d'habitants. Au comité d'habitants, j'ai proposé un tour de parole en reformulant chaque idée au tableau avant d'ouvrir le débat. Mme Diallo et M. Vergne se coupaient la parole ; j'ai posé la règle du bâton de parole, en riant, et ça a tenu. On est sortis avec trois idées pour le printemps, dont la collecte de récits sonores.\n\nTroisième soir que j'écris : je vois maintenant que mes journées réussies sont celles où j'ai renoncé à quelque chose. Relire lundi m'a aidée à préparer mercredi. Le carnet devient un outil, pas un devoir.\n\nReste Karim. Le créneau du mardi, la programmation du printemps : il va falloir que je parle. J'écris ça ici pour ne plus pouvoir faire semblant de l'oublier.\n",
      "segmentation": [{"date":"2026-01-05","debut":99,"fin":2447},{"date":"2026-01-06","debut":2447,"fin":4926},{"date":"2026-01-07","debut":4926,"fin":7524}]
    }
  ],
  "referentiels": [
    {
      "schemaVersion": "1.0.0",
      "kind": "referentiel",
      "id": "respire",
      "version": "7.0.0",
      "label": "RESPIRE v7",
      "contentHash": "b246101cab241ac3842bcdc8bc2d1672457d13b2cbff74cf734da67fa416b6b1",
      "source": "Instantané (fixture) du référentiel réel web/public/data/referentiel/respire-v7.json — reconstruit depuis agrege.par_competence (carto_merge.json) et domainsData (carto-data.js)",
      "poles": [
        {"num":1,"nom":"TETE — Penser & Comprendre","couleur":"#2563eb"},
        {"num":2,"nom":"COEUR — Relier & Naviguer","couleur":"#10b981"},
        {"num":3,"nom":"MAIN — Créer & Incarner","couleur":"#ec4899"},
        {"num":4,"nom":"AME — Discerner & Juger","couleur":"#8b5cf6"},
        {"num":5,"nom":"RACINES — Évoluer & Résister","couleur":"#f59e0b"},
        {"num":6,"nom":"CITE — Gouverner & S'ouvrir","couleur":"#06b6d4"},
        {"num":7,"nom":"FLAMBEAU — Transmettre & Piloter","couleur":"#f97316"}
      ],
      "competences": [
        {"code":"1.01","nom":"Pensée Critique & Anti-Hallucination","pole":1},
        {"code":"1.02","nom":"Cadrage de l'Intention","pole":1},
        {"code":"1.03","nom":"Synthèse Intégrative","pole":1},
        {"code":"1.04","nom":"Métacognition & Humilité Épistémique","pole":1},
        {"code":"1.05","nom":"Pensée Systémique","pole":1},
        {"code":"1.06","nom":"Littératie IA & Data Literacy","pole":1},
        {"code":"1.07","nom":"Architecture de Systèmes IA","pole":1},
        {"code":"1.08","nom":"Dialogue IA Avancé & Orchestration Multi-Agents","pole":1},
        {"code":"1.09","nom":"Pensée Computationnelle","pole":1},
        {"code":"1.10","nom":"Synergie & Coordination Hybride","pole":1},